{"schema_version": 1, "logline": "A traveller lost at dusk is guided by a girl who believes herself ugly.", "genre": "Literary fiction", "readership": "Adult readers of classic realism", "comparables": ["Novel A", "Novel B"], "market_fit": "Fits a classics list.", "verdict": "consider", "verdict_reason": "Strong voice; slow middle."}
